{
  "schemaVersion": 1,
  "version": "2026-09-15",
  "family": "rfdetr",
  "config": "nano-untiled-1024",
  "input": {
    "width": 768,
    "height": 768,
    "layout": "NCHW",
    "dtype": "float32",
    "letterbox": "stretch",
    "normalization": {
      "mean": [0.485, 0.456, 0.406],
      "std": [0.229, 0.224, 0.225]
    }
  },
  "outputs": {
    "boxes": {
      "name": null,
      "format": "cxcywh-normalized"
    },
    "logits": {
      "name": null,
      "activation": "sigmoid",
      "classes": 1
    }
  },
  "thresholds": {
    "default": 0.6,
    "sweep": [0.05, 0.1, 0.15, 0.2, 0.3, 0.4, 0.5, 0.6, 0.7]
  },
  "files": [
    {
      "path": "model-int8.onnx",
      "bytes": 31327953,
      "sha256": "84c74bc17fd078adaf33d49d8af2dc61a97daeb91b3cf0f8141cddea1c3f467c",
      "dtype": "int8"
    }
  ],
  "training": {
    "dataset": "Roboflow climbing-holds-and-volumes v14, single `hold` class, full train split (3,876 photos / 129,868 boxes)",
    "licence": "CC BY 4.0",
    "epochs": 10,
    "trainedOn": "m5-max-mps",
    "date": "2026-09-15"
  },
  "licence": "Apache-2.0",
  "eval": {
    "sprayEvalF1": 0.6588,
    "weightedCorrectionsPerHold": 0.6598,
    "gestureSavings": 0.489
  }
}
